energy_source,title,description,published_at,source_name,url,sentiment_compound,sentiment_positive,sentiment_negative,sentiment_neutral,sentiment_label,date
nuclear energy,The Most Overlooked Holiday Miracle: Abundance,History shows clearly that the societies most capable of generosity and liberalism are not those trapped in poverty but those that have escaped it.,2025-12-25 06:37:34+00:00,Reason,https://reason.com/2025/12/25/the-most-overlooked-holiday-miracle-abundance/,0.7987,0.33,0.088,0.581,positive,2025-12-25
nuclear energy,US Or China? The Nation That Wins The Nuclear Fusion Race Wins Global Primacy,"There continues to be a debate among global geopolitical analysts regarding whether the United States and China are engaged in a Cold War or a competition for global dominance.The answer is irrelevant.By anyone's observation, China seeks to dominate the 21st …",2025-12-25 06:04:14+00:00,Freerepublic.com,https://freerepublic.com/focus/f-news/4358934/posts,0.8176,0.204,0.085,0.711,positive,2025-12-25
nuclear energy,Destroying countrysides to save Earth from a climate non-crisis,"Climate-obsessed national governments often act to control local voices and choices in pursuit of “decarbonization” even without being bound by international treaties. However, nations frequently trample on both state and local needs and concerns by signing o…",2025-12-25 06:00:00+00:00,Wattsupwiththat.com,https://wattsupwiththat.com/2025/12/24/destroying-countrysides-to-save-earth-from-a-climate-non-crisis/,-0.1027,0.064,0.072,0.863,negative,2025-12-25
nuclear energy,Key questions remain after Zelensky reveals US-Ukraine plan to end Russian war,"Ukraine won some limited concessions in the latest version of a U.S.-led draft plan to end the Russian invasion, President Volodymyr Zelensky has revealed, though key questions remain over territory and whether Moscow could accept the new terms.",2025-12-25 05:48:25+00:00,Hurriyet Daily News,https://www.hurriyetdailynews.com/key-questions-remain-after-zelensky-reveals-us-ukraine-plan-to-end-russian-war-217170,0.128,0.11,0.102,0.788,positive,2025-12-25
nuclear energy,The best video essays of 2025 | Sight and Sound,"Now in its ninth year, our annual poll showcases 255 vital video essays, nominated by 72 international voters.",2025-12-25 05:47:01+00:00,British Film Institute,https://www.bfi.org.uk/sight-and-sound/polls/best-video-essays-2025,0.7506,0.204,0.0,0.796,positive,2025-12-25
nuclear energy,"Yearender 2025: How India managed tariffs, conflicts, and diplomatic wins","As the year draws to a close, prospects for an India-US trade pact appear strong, while efforts to consolidate Delhi’s strategic footprint in West Asia and the Horn of Africa are intensified. But the year also saw a military confrontation with Pakistan and a …",2025-12-25 05:44:09+00:00,The Indian Express,https://indianexpress.com/article/upsc-current-affairs/upsc-essentials/yearender-2025-how-india-managed-tariffs-conflicts-and-diplomatic-wins-10437335/,0.09,0.107,0.084,0.809,positive,2025-12-25
nuclear energy,North Korea's Kim Jong Un visits nuclear subs as Vladimir Putin hails 'invincible' bond,"North Korean leader Kim Jong Un visited a nuclear submarine factory and received a message from Russia's Vladimir Putin hailing the countries' ""invincible friendship"", Pyongyang's state media said Thursday. The ""heroic"" efforts of North Korean soldiers in Rus…",2025-12-25 05:16:48+00:00,The Times of India,https://economictimes.indiatimes.com/news/defence/north-koreas-kim-jong-un-visits-nuclear-subs-as-vladimir-putin-hails-invincible-bond/articleshow/126170638.cms,0.4939,0.061,0.0,0.939,positive,2025-12-25
nuclear energy,North Korea's Kim Jong Un visits nuclear subs as Vladimir Putin hails 'invincible' bond,"North Korean leader Kim Jong Un visited a nuclear submarine factory and received a message from Russia's Vladimir Putin hailing the countries' ""invincible friendship"", Pyongyang's state media said Thursday. The ""heroic"" efforts of North Korean soldiers in Rus…",2025-12-25 05:16:48+00:00,The Times of India,https://economictimes.indiatimes.com/news/defence/north-koreas-kim-jong-un-visits-nuclear-subs-as-vladimir-putin-hails-invincible-bond/articleshow/126170589.cms,0.4939,0.061,0.0,0.939,positive,2025-12-25
nuclear energy,North Korea's Kim visits nuclear subs as Putin hails 'invincible' bond,"North Korean leader Kim Jong Un visited a nuclear submarine factory and received a message from Russia's Vladimir Putin hailing the countries' &quot;invincible friendship&quot;, Pyongyang's state media said Thursday. North Korea and Russia have drawn closer s…",2025-12-25 05:08:32+00:00,Japan Today,https://japantoday.com/category/world/north-korea%27s-kim-visits-nuclear-subs-as-putin-hails-%27invincible%27-bond,0.0,0.0,0.0,1.0,neutral,2025-12-25
nuclear energy,Nuclear Developer Proposes Using Navy Reactors For Data Centers,An anonymous reader quotes a report from the Financial Post: A Texas power developer is proposing to repurpose nuclear reactors from Navy warships to power the United States grid as the Trump administration pushes to secure massive amounts of energy for the a…,2025-12-25 03:30:00+00:00,Slashdot.org,https://hardware.slashdot.org/story/25/12/24/1920243/nuclear-developer-proposes-using-navy-reactors-for-data-centers,0.7003,0.133,0.027,0.839,positive,2025-12-25
nuclear energy,IAEA Sees No Signs of Countries Preparing to Resume Nuclear Testing - Grossi,"The International Atomic Energy Agency (IAEA) sees no signs of nuclear powers preparing to resume nuclear testing, IAEA Director Rafael Grossi said in an interview with Sputnik.",2025-12-25 03:19:00+00:00,Sputnikglobe.com,https://sputnikglobe.com/20251225/iaea-sees-no-signs-of-countries-preparing-to-resume-nuclear-testing---grossi-1123361096.html,-0.3182,0.049,0.104,0.847,negative,2025-12-25
nuclear energy,North Korea’s Kim visits nuclear subs as Putin hails ‘invincible’ bond,"North Korean leader Kim Jong Un visited a nuclear submarine factory and received a message from Russia’s Vladimir Putin hailing the countries’ “invincible friendship”, state media said Thursday. North Korea and Russia have drawn closer since Moscow launched i…",2025-12-25 03:03:13+00:00,Digital Journal,https://www.digitaljournal.com/world/north-koreas-kim-visits-nuclear-subs-as-putin-hails-invincible-bond/article,0.128,0.031,0.0,0.969,positive,2025-12-25
nuclear energy,North Korea’s Kim slams US-Seoul nuclear submarine deal as ‘offensive act’,Kim Jong Un made the comments while inspecting a North Korean nuclear submarine facility on Wednesday.,2025-12-25 02:40:07+00:00,Al Jazeera English,https://www.aljazeera.com/news/2025/12/25/north-koreas-kim-slams-us-seoul-nuclear-submarine-deal-as-offensive-act,0.0,0.0,0.0,1.0,neutral,2025-12-25
nuclear energy,Scientists Warn Asteroid YR4 May Impact Earth - What We Know So far [20:22],"Asteroid 2024 YR4, has sparked concern about its chance of hitting Earth in December 2032. How worried should we be? Scientists Warn Asteroid YR4 May Impact Earth - What We Know So far | 20:22 Dr Ben Miles | 2.17M subscribers | 462,064 views | February 23, 20…",2025-12-25 02:14:22+00:00,Freerepublic.com,https://freerepublic.com/focus/f-chat/4358918/posts,-0.25,0.034,0.085,0.881,negative,2025-12-25
nuclear energy,What does U.S. law really say about health coverage for immigrants?,"This is a Gateway Hispanic article.
The post What does U.S. law really say about health coverage for immigrants? appeared first on The Gateway Pundit.",2025-12-25 01:30:00+00:00,Gatewayhispanic.com,https://gatewayhispanic.com/2025/12/what-does-u-s-law-really-say-about/,0.0,0.0,0.0,1.0,neutral,2025-12-25
nuclear energy,Iran refuses inspection of nuclear sites until IAEA provides new guidelines after bombing | CNN,"Iran has said it will not comply with any demands from the UN’s nuclear watchdog to inspect its bombed nuclear sites, citing the absence of established regulations for inspecting facilities damaged by military strikes.",2025-12-25 00:42:04+00:00,CNN,https://www.cnn.com/2025/12/24/middleeast/iran-refuses-iaea-inspection-of-nuclear-sites-intl-latam,-0.6597,0.0,0.105,0.895,negative,2025-12-25
nuclear energy,"Kim Jong Un Oversees Test of New Anti-Air Missile, KCNA Says","North Korean leader Kim Jong Un oversaw the testing of a new type of high-altitude, long-range missile, state media reported, ratcheting up tensions after a US nuclear submarine arrived at the South Korean port of Busan a day earlier.",2025-12-25 00:40:15+00:00,Financial Post,https://financialpost.com/pmn/business-pmn/kim-jong-un-oversees-test-of-new-anti-air-missile-kcna-says,-0.4019,0.0,0.055,0.945,negative,2025-12-25
nuclear energy,"What old, dying stars teach us about axions as a candidate for dark matter",The axion could be a contender to explain the mystery of dark matter.,2025-12-24 22:00:00+00:00,Space.com,https://www.space.com/astronomy/stars/what-old-dying-stars-teach-us-about-axions-as-a-candidate-for-dark-matter,0.1779,0.144,0.0,0.856,positive,2025-12-24
nuclear energy,Frank Darabont on Coming Out of Retirement for ‘Stranger Things 5’: ‘It Was a Hell of a Great Experience’,"Frank Darabont was still new to retirement when Netlix released the first season of “Stranger Things” in 2016. He had wrapped his final directing gig — the 2013 “Mob City” episode “Red Light”— and moved with his wife to California’s Central Coast, where he co…",2025-12-24 21:30:00+00:00,Variety,https://variety.com/2025/tv/news/frank-darabont-on-stranger-things-5-1236606884/,-0.128,0.061,0.068,0.871,negative,2025-12-24
nuclear energy,‘Pluribus’ Episode 9 Recap: Save the World or Get the Girl (Season 1 Finale),"“They are not human."" ""They are still human.""",2025-12-24 21:00:00+00:00,Decider,https://decider.com/2025/12/24/pluribus-episode-9-recap/,0.4939,0.144,0.0,0.856,positive,2025-12-24
nuclear energy,Zelenskyy says he's open to creating demilitarized zone in Ukraine's industrial heartland,"Ukrainian President Volodymyr Zelenskyy said he would be willing to withdraw troops from the country’s eastern industrial heartland as part of a plan to end Russia’s war, if Moscow also pulls back and the area becomes a demilitarized zone monitored by interna…",2025-12-24 20:44:23+00:00,Japan Today,https://japantoday.com/category/world/us-and-ukraine-reach-consensus-on-key-issues-but-territorial-disputes-unresolved,-0.4019,0.039,0.07,0.891,negative,2025-12-24
nuclear energy,Russia plans a nuclear power plant on the moon within a decade,"MOSCOW, Dec 24 (Reuters) - Russia plans to put a nuclear power plant on the moon in the next decade to supply its lunar space programme and a joint Russian...",2025-12-24 20:37:57+00:00,Yahoo Entertainment,https://www.yahoo.com/news/articles/russia-plans-nuclear-power-plant-073012984.html,0.0,0.0,0.0,1.0,neutral,2025-12-24
nuclear energy,Zelensky offers peace concessions to Putin,Ukrainian President Volodymyr Zelensky on Tuesday presented a new 20-point peace plan that offers concessions to Russia in an effort to end the conflict in...,2025-12-24 20:23:40+00:00,The Hill,https://thehill.com/policy/international/5662597-zelensky-presents-ukraine-peace-plan/,0.6908,0.193,0.063,0.744,positive,2025-12-24
nuclear energy,Feature: Chinese technology helps Iraq develop smarter oilfields,"BAGHDAD, Dec. 24 (Xinhua) -- ""Iraqi oilfield operations have become smarter and more efficient thanks to China's advanced drilling technologies,"" said Hussein Mohammed, an Iraqi engineer who has worked alongside Chinese technicians on maintaining high-end dri…",2025-12-24 19:18:00+00:00,The Star Online,https://www.thestar.com.my/news/world/2025/12/25/feature-chinese-technology-helps-iraq-develop-smarter-oilfields,0.942,0.307,0.0,0.693,positive,2025-12-24
fossil fuels,New electrochemical method splits water with electricity to produce hydrogen fuel — and cuts energy costs in the process,Scientists adapted a method that can produce double the amount of hydrogen when splitting water molecules with electricity.,2025-12-26 18:15:00+00:00,Live Science,https://www.livescience.com/chemistry/new-electrochemical-method-splits-water-with-electricity-to-produce-hydrogen-fuel-and-cuts-energy-costs-in-the-process,-0.0258,0.056,0.059,0.885,neutral,2025-12-26
fossil fuels,Electric ain't the only silver bullet,"India's clean mobility push needs strategic breadth beyond just electric vehicles. Relying solely on EVs creates new dependencies and ignores cleaner alternatives like biofuels and flex-fuel vehicles. A diversified approach, integrating these options, offers …",2025-12-26 17:31:46+00:00,The Times of India,https://economictimes.indiatimes.com/opinion/et-commentary/electric-aint-the-only-silver-bullet/articleshow/126193592.cms,0.7096,0.2,0.047,0.754,positive,2025-12-26
fossil fuels,Charting The Changes That Will Lead To Renewable Energy Dominance In 2026,"Renewable energy is moving ahead all around the world, while the US sucks its thumb and whines about how good things were in the 1950s. 
The post Charting The Changes That Will Lead To Renewable Energy Dominance In 2026 appeared first on CleanTechnica.",2025-12-26 17:26:28+00:00,CleanTechnica,https://cleantechnica.com/2025/12/26/charting-the-changes-that-will-lead-to-renewable-energy-dominance-in-2026/,0.6705,0.197,0.081,0.722,positive,2025-12-26
fossil fuels,Latin America’s Year in Review,"In 2025, the region went up against tariffs, deportations, and a major U.S. military buildup.",2025-12-26 13:00:35+00:00,Foreign Policy,http://foreignpolicy.com/2025/12/26/latin-america-trump-us-tariffs-deportations-venezuela-brazil-argentina-mexico/,0.0,0.0,0.0,1.0,neutral,2025-12-26
fossil fuels,"The World Has Laws About Land and Sea, But Not About Ice","As the Arctic melts and people spend more time there, defining our relationship to sea ice becomes more necessary.",2025-12-26 13:00:00+00:00,The Atlantic,https://www.theatlantic.com/science/2025/12/sea-ice-law/685401/,0.0,0.0,0.0,1.0,neutral,2025-12-26
fossil fuels,The Pentagon is Hoarding Critical Minerals That Could Power the Clean Energy Transition,"This story was originally published by Grist and is reproduced here as part of the Climate Desk collaboration. Pete Hegseth, who has taken to calling himself the Secretary of War, says the Defense Department “does not do climate change crap.” Just last week, …",2025-12-26 12:30:00+00:00,Mother Jones,https://www.motherjones.com/politics/2025/12/the-pentagon-is-hoarding-critical-minerals-that-could-power-the-clean-energy-transition/,-0.2263,0.099,0.098,0.803,negative,2025-12-26
fossil fuels,What Mess Will Trump Have Made of the USA by 2029?,"For writers, the future has long been a tricky terrain. While the past can prove unsettling and the present uncomfortable, the future seems to free the mind from reality’s restraints and let the imagination soar. Yet it has also proven full of political pitfa…",2025-12-26 12:29:02+00:00,Tomdispatch.com,https://tomdispatch.com/ending-the-american-dream-by-2029/,-0.34,0.055,0.112,0.833,negative,2025-12-26
fossil fuels,"AI growth faces Power, Resource and Safety hurdles despite big productivity promise: JP Morgan","The report said that concerns around limited resources, data privacy and safety will play a key role in determining how fast and how widely AI technologies are adopted",2025-12-26 09:33:26+00:00,BusinessLine,https://www.thehindubusinessline.com/info-tech/ai-growth-faces-power-resource-and-safety-hurdles-despite-big-productivity-promise-jp-morgan/article70439383.ece,0.8508,0.258,0.076,0.667,positive,2025-12-26
fossil fuels,"Air pollution India's biggest health crisis since Covid, warn doctors",Union transport minister Nitin Gadkari on Tuesday admitted that nearly 40% of the pollution in Delhi is caused by the transport sector due to dependence on fossil fuels,2025-12-26 09:25:25+00:00,BusinessLine,https://www.thehindubusinessline.com/news/air-pollution-indias-biggest-health-crisis-since-covid-warn-doctors/article70439357.ece,-0.6249,0.033,0.131,0.835,negative,2025-12-26
fossil fuels,Green Debt Surge Bucks Climate Policy Rollbacks,"Global green bond and loan issuance has reached a record $947 billion so far this year, according to data compiled by Bloomberg Intelligence.",2025-12-26 08:44:24+00:00,Rigzone,https://www.rigzone.com/news/wire/green_debt_surge_bucks_climate_policy_rollbacks-26-dec-2025-182620-article/,0.25,0.136,0.076,0.788,positive,2025-12-26
fossil fuels,"AI growth faces power, resource and safety hurdles despite big productivity promise: JP Morgan","The journey of artificial intelligence is not without its roadblocks. Critical factors like limited resources, privacy concerns, and safety considerations are pivotal in determining its future landscape. The increasing demand for power presents a formidable c…",2025-12-26 08:38:35+00:00,The Times of India,https://economictimes.indiatimes.com/tech/artificial-intelligence/ai-growth-faces-power-resource-and-safety-hurdles-despite-big-productivity-promise-jp-morgan/articleshow/126186840.cms,0.9175,0.292,0.086,0.622,positive,2025-12-26
fossil fuels,"Grid Down, Power Up: The silent threat to national survival","The U.S. power grid is critically vulnerable due to its aging infrastructure, centralized design for efficiency over resilience, and underinvestment in security, making it a prime target for adversaries. A prolonged, nationwide grid failure would be catastrop…",2025-12-26 06:00:00+00:00,Naturalnews.com,https://www.naturalnews.com/2025-12-26-grid-down-power-up-threat-national-survival.html,-0.6908,0.09,0.194,0.716,negative,2025-12-26
fossil fuels,E&E News: “The Paris Agreement at 10: What the World has Achieved”,"Not much, really. Just a whole lot of waste and false hopes with massive government intervention to create a wind/solar/battery bubble. The subtitle of the CLIMATEWire piece said much: “The blockbuster climate deal made history a decade ago. But its record at…",2025-12-26 06:00:00+00:00,Wattsupwiththat.com,https://wattsupwiththat.com/2025/12/25/ee-news-the-paris-agreement-at-10-what-the-world-has-achieved/,0.6249,0.143,0.034,0.823,positive,2025-12-26
fossil fuels,"Air pollution India's biggest health crisis since Covid, warn doctors","Speaking to PTI, multiple senior doctors practising in the UK asserted that a vast, hidden burden of undiagnosed airway disease is ""building beneath the surface"" and its incoming wave will exact a heavy, lasting toll on Indian citizens and its healthcare syst…",2025-12-26 03:33:13+00:00,The Times of India,https://economictimes.indiatimes.com/industry/healthcare/biotech/healthcare/air-pollution-indias-biggest-health-crisis-since-covid-warn-doctors/articleshow/126182273.cms,-0.8126,0.0,0.152,0.848,negative,2025-12-26
fossil fuels,Why does coral bleach chasing coral?,"Why Does Coral Bleach Chasing Coral? The Surprising Truth The phenomenon of “Why does coral bleach chasing coral?” is, at its heart, a misconception arising from observation and interpretation of reef degradation. The appearance of bleaching seemingly spreadi…",2025-12-26 02:44:56+00:00,Lifesciencesworld.com,https://www.lifesciencesworld.com/why-does-coral-bleach-chasing-coral/,0.1381,0.102,0.07,0.827,positive,2025-12-26
fossil fuels,Green debt sales hit record levels in 2025 despite climate backlash,The flows are notable in year when Trump backed fossil fuels and dismantled clean-energy subsidies and legislation. Read more at straitstimes.com. Read more at straitstimes.com.,2025-12-26 01:30:49+00:00,The Straits Times,https://www.straitstimes.com/business/companies-markets/green-debt-sales-hit-record-levels-in-2025-despite-climate-backlash,-0.34,0.029,0.066,0.904,negative,2025-12-26
fossil fuels,Global Times- 2025 Yearender: China as a visionary power in a turbulent world,"Amid global turmoil in 2025, China emerged as an oasis of certainty through stable governance, future planning, diplomacy, innovation and green growth. Amid global turmoil in 2025, China emerged as an oasis of certainty through stable governance, future plann…",2025-12-26 01:28:00+00:00,GlobeNewswire,https://www.globenewswire.com/news-release/2025/12/26/3210487/0/en/Global-Times-2025-Yearender-China-as-a-visionary-power-in-a-turbulent-world.html,0.875,0.27,0.079,0.651,positive,2025-12-26
fossil fuels,Green Debt Sales Hit Record Levels Despite Climate Backlash,"Investors have piled into climate-friendly assets this year despite policy and regulatory rollbacks in the US and Europe, as artificial intelligence drives a boom in energy infrastructure demand.",2025-12-26 00:07:57+00:00,Financial Post,https://financialpost.com/pmn/business-pmn/green-debt-sales-hit-record-levels-despite-climate-backlash,0.4404,0.165,0.095,0.74,positive,2025-12-26
fossil fuels,Dem Rep. Levin on Falling Fuel Costs: Doubling Down on Fossil Fuels Means More Volatility,"On Tuesday’s broadcast of CNN’s “The Story Is,” Rep. Mike Levin (D-CA) stated that people don’t feel increasing GDP when they look at fuel costs and responded to fuel costs falling in many places by stating that “doubling down on
The post Dem Rep. Levin on Fa…",2025-12-25 23:31:23+00:00,Breitbart News,https://www.breitbart.com/clips/2025/12/25/dem-rep-levin-on-falling-fuel-costs-doubling-down-on-fossil-fuels-means-more-volatility/,-0.296,0.0,0.051,0.949,negative,2025-12-25
fossil fuels,The Resilience of the Church of Climate,"In the aftermath of the UN’s COP30 climate summit in Belem, Brazil, several commentators have claimed that the age of climate alarmism may finally be fraying at the edges. The Wall Street Journal concluded that Europe’s green energy policies slashed emissions…",2025-12-25 14:00:00+00:00,Wattsupwiththat.com,https://wattsupwiththat.com/2025/12/25/the-resilience-of-the-church-of-climate/,-0.0258,0.042,0.064,0.895,neutral,2025-12-25
fossil fuels,It’s a Gas,I’m writing this in the last days of the northern hemisphere’s autumn in 2025. Over recent weeks we’ve seen a hurricane hit Jamaica with wind speeds a few hundred feet above sea level topping 250 miles per hour and a rainstorm in central Vietnam that dropped …,2025-12-25 13:00:00+00:00,The New York Review of Books,http://www.nybooks.com/articles/2026/01/15/its-a-gas-the-story-of-co2-mckibben/,0.0,0.0,0.0,1.0,neutral,2025-12-25
fossil fuels,"How 2025 made India more nimble, agile and attractive","In 2025, India enacted significant economic reforms to boost competitiveness and resilience amidst global uncertainties. Key initiatives included income-tax relief, GST restructuring, labor code modernisation, and FDI liberalisation in insurance. These measur…",2025-12-25 09:20:25+00:00,The Times of India,https://economictimes.indiatimes.com/news/economy/policy/modi-government-reforms-india-economy-in-2025-how-2025-made-india-more-nimble-agile-and-attractive/articleshow/126172306.cms,0.7964,0.215,0.049,0.736,positive,2025-12-25
fossil fuels,Skeptical Science New Research for Week #52 2025,"Open access notables

Satellite altimetry reveals intensifying global river water level variability, Fang et al., Nature Communications

River water levels (RWLs) are fundamental to hydrology, water resource management, and disaster mitigation, yet the majori…",2025-12-25 07:06:28+00:00,Skepticalscience.com,https://skepticalscience.com/new_research_2025_52.html,-0.7506,0.0,0.138,0.862,negative,2025-12-25
fossil fuels,The Most Overlooked Holiday Miracle: Abundance,History shows clearly that the societies most capable of generosity and liberalism are not those trapped in poverty but those that have escaped it.,2025-12-25 06:37:34+00:00,Reason,https://reason.com/2025/12/25/the-most-overlooked-holiday-miracle-abundance/,0.7987,0.33,0.088,0.581,positive,2025-12-25
fossil fuels,Vehicle-To-Home Charging Shown To Save EV Owners Up To 90%,"You already know you can use your home's power sources to charge your electric vehicle, but soon you may be able to power your house from your vehicle.",2025-12-25 05:01:58+00:00,SlashGear,https://www.slashgear.com/2056555/vehicle-to-home-ev-charging-study-90-percent/,0.2732,0.054,0.0,0.946,positive,2025-12-25
fossil fuels,The Best Christmas Horror Movies Ever Made,"From the seedy depravity of ""Don't Open till Christmas"" to the contemporary haunting of ""Krampus,"" these holiday genre films deliver a little bit of everything — freaky fruitcake style.",2025-12-24 22:30:00+00:00,IndieWire,https://www.indiewire.com/lists/best-christmas-horror-movies/,-0.1027,0.156,0.188,0.656,negative,2025-12-24
fossil fuels,Why this 80-year-old Anglican deacon courted arrest for his climate activism,"Faith leaders are increasingly speaking out, and even facing arrest, for their climate activism.",2025-12-24 21:34:19+00:00,CBC News,https://www.cbc.ca/news/science/faith-climate-emissions-activism-9.7027802,-0.25,0.095,0.162,0.743,negative,2025-12-24
fossil fuels,"Neil Frank, former hurricane center chief who improved public outreach on storms, has died","Neil Frank, a former head of the National Hurricane Center credited with working to increase the country’s readiness for major storms, has died",2025-12-24 21:31:51+00:00,ABC News,https://abcnews.go.com/US/wireStory/neil-frank-former-hurricane-center-chief-improved-public-128685709,0.4215,0.249,0.149,0.602,positive,2025-12-24
fossil fuels,Analysts Call Trump's Policy 'Resource Nationalism',"President Trump's latest idea for Venezuelan oil isn't a one-off, experts say, but part of a years-long pattern of treating foreign resources as prizes for the taking. In recent weeks, the Trump administration has stepped up its campaign against President Nic…",2025-12-24 19:39:51+00:00,Newser,https://www.newser.com/story/380941/analysts-call-trumps-policy-resource-nationalism.html,0.6124,0.083,0.0,0.917,positive,2025-12-24
