energy_source,title,description,published_at,source_name,url,sentiment_compound,sentiment_positive,sentiment_negative,sentiment_neutral,sentiment_label,date
solar energy,"China’s Solar Rebound Signals Discipline, Not Another Boom","China’s solar installations jumped to a six-month high in November, with developers adding roughly 22 gigawatts of new capacity, according to data released by the National Energy Administration. That’s even after 2025 proved to be a brutal year defined less b…",2025-12-26 18:30:00+00:00,OilPrice.com,https://oilprice.com/Latest-Energy-News/World-News/Chinas-Solar-Rebound-Signals-Discipline-Not-Another-Boom.html,-0.4588,0.041,0.08,0.879,negative,2025-12-26
solar energy,Why is Trump killing off clean energy?,President halts offshore wind farm construction,2025-12-26 17:39:53+00:00,The Week Magazine,https://theweek.com/politics/trump-against-wind-energy-backlash,-0.4019,0.149,0.243,0.608,negative,2025-12-26
solar energy,Charting The Changes That Will Lead To Renewable Energy Dominance In 2026,"Renewable energy is moving ahead all around the world, while the US sucks its thumb and whines about how good things were in the 1950s. 
The post Charting The Changes That Will Lead To Renewable Energy Dominance In 2026 appeared first on CleanTechnica.",2025-12-26 17:26:28+00:00,CleanTechnica,https://cleantechnica.com/2025/12/26/charting-the-changes-that-will-lead-to-renewable-energy-dominance-in-2026/,0.6705,0.197,0.081,0.722,positive,2025-12-26
solar energy,Uncover 4 Undervalued Tech Giants Before They Skyrocket in 2026,"Four mega-cap tech stocks still trade at discounts despite a strong 2025 rally, with AI infrastructure and data center demand setting the stage for 2026...",2025-12-26 17:20:00+00:00,Yahoo Entertainment,https://finance.yahoo.com/news/uncover-4-undervalued-tech-giants-172000674.html,-0.4943,0.0,0.119,0.881,negative,2025-12-26
solar energy,"Filmmaker Amos Poe Dies at 76, ‘Red, White, and Blue’ British Museum Ball Invites Controversy, and: Morning Links for December 26, 2026","Controversy around the British Museum fundraising ball, a new Asian cultural partnership, and more.",2025-12-26 15:42:33+00:00,ARTnews,https://www.artnews.com/art-news/news/filmmaker-amos-poe-dies-at-76-red-white-and-blue-british-museum-ball-invites-controversy-and-morning-links-for-december-26-2026-1234768167/,0.0,0.0,0.0,1.0,neutral,2025-12-26
solar energy,Coal India board appoints CMD B Sairam as CEO,"Coal India appoints B Sairam as its first-ever CEO, aiming to enhance operations and align with evolving energy sector dynamics.",2025-12-26 15:34:59+00:00,BusinessLine,https://www.thehindubusinessline.com/companies/coal-india-board-appoints-cmd-b-sairam-as-ceo/article70440789.ece,0.4939,0.144,0.0,0.856,positive,2025-12-26
solar energy,Green Rain Energy Holdings (OTCID: $GREH) Extends Warm Wishes for a Safe and Prosperous New Year,Happy New Year From OTC: $GREH...,2025-12-26 15:34:00+00:00,GlobeNewswire,https://www.globenewswire.com/news-release/2025/12/26/3210568/0/en/Green-Rain-Energy-Holdings-OTCID-GREH-Extends-Warm-Wishes-for-a-Safe-and-Prosperous-New-Year.html,0.93,0.545,0.0,0.455,positive,2025-12-26
solar energy,Elon Musk drops ‘sustainable’ from Tesla’s mission as he completes his villain arc,"It’s official. The word “sustainable” is gone from Tesla’s mission statement.



For over a decade, Tesla’s guiding star was arguably the most impactful corporate mission statement of the 21st century. But over the last few years, we have watched the company …",2025-12-26 15:07:05+00:00,Electrek,http://electrek.co/2025/12/26/elon-musk-drops-sustainable-teslas-mission-completes-villain-arc/,-0.4215,0.0,0.069,0.931,negative,2025-12-26
solar energy,"Silver soars to Rs 2.32 lakh/kg, Gold tops Rs 1.37 lakh/ amid strong demand","Silver prices soared to Rs 2.32 lakh per kg on Friday, marking a record high this year, while gold touched Rs 1.37 lakh per 10 gm. Strong industrial demand, supply constraints, festive buying, and global macro factors have fueled the rally, with experts expec…",2025-12-26 14:58:21+00:00,The Times of India,https://economictimes.indiatimes.com/markets/commodities/news/silver-soars-to-rs-2-32-lakh/kg-gold-tops-rs-1-37-lakh/-amid-strong-demand/articleshow/126192030.cms,0.8979,0.193,0.045,0.762,positive,2025-12-26
solar energy,Bacolod: Neg Occ expands solar use in key government buildings,"BACOLOD CITY — The Provincial Government of Negros Occidental has partnered with WeGen Energy Philippines Inc. to complete three major solar energy projects before the end of 2025. The solar installations now power the Provincial Capitol Building, the Negros …",2025-12-26 14:44:49+00:00,Rpnradio.com,https://rpnradio.com/bacolod-neg-occ-expands-solar-use-in-key-government-buildings/,0.5574,0.111,0.0,0.889,positive,2025-12-26
solar energy,Turkey Makes Another $9 Billion Bet on Russian Nuclear Power,"Turkey just took another very large, very deliberate step deeper into Russia’s energy orbit — and this time it comes with a $9 billion price tag. Ankara says that Russia has provided $9 billion in new financing for the Akkuyu nuclear power plant, Turkey’s fir…",2025-12-26 14:30:00+00:00,OilPrice.com,https://oilprice.com/Latest-Energy-News/World-News/Turkey-Makes-Another-9-Billion-Bet-on-Russian-Nuclear-Power.html,0.2732,0.039,0.0,0.961,positive,2025-12-26
solar energy,"Optimized steam boiler for soil steam disinfection: Structural design, CFD simulation, and field application","Soil steam disinfection offers a chemical-free solution to soil-borne pathogens and continuous cropping obstacles; however, its adoption in facility agriculture is severely limited by the lack of mobile and efficient steam generation systems. Conventional ele…",2025-12-26 14:00:00+00:00,Plos.org,https://journals.plos.org/plosone/article?id=10.1371/journal.pone.0340080,-0.1779,0.138,0.166,0.696,negative,2025-12-26
solar energy,Chemtrails Aren’t Real. So Why Are Politicians Passing Laws About Them?,"Banning chemtrails is “like banning unicorns or banning Bigfoot,” says one weather expert",2025-12-26 14:00:00+00:00,Rolling Stone,http://www.rollingstone.com/politics/politics-features/chemtrails-banning-laws-1235488069/,0.0,0.0,0.0,1.0,neutral,2025-12-26
solar energy,Why America Might Find Coal in Its Stocking This Christmas — And Be Jolly,"The United States is projected to generate more power from coal in 2025 than in 2024, though the resource has endured an assault from the executive branch, green groups and Congress in recent years.",2025-12-26 14:00:00+00:00,Wattsupwiththat.com,https://wattsupwiththat.com/2025/12/26/why-america-might-find-coal-in-its-stocking-this-christmas-and-be-jolly/,0.3182,0.113,0.071,0.816,positive,2025-12-26
solar energy,Unplugging these 7 common household devices easily reduced my electricity bill,"You might be shocked at how many 'vampire devices' could be in your home, silently draining power.",2025-12-26 13:00:51+00:00,ZDNet,https://www.zdnet.com/home-and-office/energy/unplug-7-common-household-devices-reduce-electricity/,0.0258,0.081,0.077,0.842,neutral,2025-12-26
solar energy,Friday Rockpile: ‘Tis the season to reflect on Rockies community giving,"Colorado Rockies news and links for Friday, December 26, 2025",2025-12-26 13:00:00+00:00,Purple Row,https://www.purplerow.com/rockies-news/78243/tis-the-season-to-reflect-on-colorado-rockies-community-giving,0.34,0.107,0.0,0.893,positive,2025-12-26
solar energy,Trump's return brought stiff headwinds for clean energy. So why are advocates optimistic in 2026?,"Clean energy faced major policy setbacks in 2025, but solar and battery storage still dominated new power added to the grid.",2025-12-26 12:30:00+00:00,Roanoke Times,https://roanoke.com/news/nation-world/government-politics/article_1707c42b-12e6-5c56-a995-e52e8f730f3f.html,0.6652,0.214,0.0,0.786,positive,2025-12-26
solar energy,What Mess Will Trump Have Made of the USA by 2029?,"For writers, the future has long been a tricky terrain. While the past can prove unsettling and the present uncomfortable, the future seems to free the mind from reality’s restraints and let the imagination soar. Yet it has also proven full of political pitfa…",2025-12-26 12:29:02+00:00,Tomdispatch.com,https://tomdispatch.com/ending-the-american-dream-by-2029/,-0.34,0.055,0.112,0.833,negative,2025-12-26
solar energy,Why India’s clean energy push now hinges on grid readiness and storage,"India is prioritizing grid readiness for its growing clean energy ambitions. COP30 discussions highlight the need for robust transmission, energy storage, and local manufacturing. Hitachi Energy is a key player in developing high-voltage direct current links …",2025-12-26 11:41:24+00:00,The Times of India,https://economictimes.indiatimes.com/industry/energy/power/why-indias-clean-energy-push-now-hinges-on-grid-readiness-and-storage/articleshow/126189596.cms,0.9601,0.403,0.0,0.597,positive,2025-12-26
solar energy,Letter: Honua Ola energy plant will be green and clean | Honolulu Star-Advertiser,"This is in reply to Ben Davis’ letter, which requires clarification about Honua Ola Bioenergy’s operations (“Honua Ola plant not part of green energy future,” Star-Advertiser, Dec. 16). First of all, Ben, welcome to the Pepeekeo neighborhood. Honua Ola will p…",2025-12-26 11:14:02+00:00,Honolulu Star-Advertiser,https://www.staradvertiser.com/2025/12/26/editorial/letters/letter-honua-ola-energy-plant-will-be-green-and-clean/,0.836,0.168,0.0,0.832,positive,2025-12-26
solar energy,"The paints, coatings, and chemicals making the world a cooler place","It’s getting harder to beat the heat. During the summer of 2025, heat waves knocked out power grids in North America, Europe, and the Middle East. Global warming means more people need air-­conditioning, which requires more power and strains grids. But a mill…",2025-12-26 11:00:00+00:00,MIT Technology Review,https://www.technologyreview.com/2025/12/26/1129301/paint-coating-chemicals-materials-cooling-air-conditioning/,-0.1108,0.025,0.033,0.943,negative,2025-12-26
solar energy,"Canton Fair's December Industry Thematic Event Focuses on Lighting, Electrical, Hardware, and Tools","GUANGZHOU, China, Dec. 26, 2025 /PRNewswire/ -- The Canton Fair has expanded its digital capabilities to boost high-quality foreign trade by introducing its year-round online platform featuring monthly industry themes. The December edition focuses on the Ligh…",2025-12-26 10:45:00+00:00,PR Newswire UK,https://www.prnewswire.co.uk/news-releases/canton-fairs-december-industry-thematic-event-focuses-on-lighting-electrical-hardware-and-tools-302649597.html,0.6124,0.094,0.0,0.906,positive,2025-12-26
solar energy,I’m the new Virginia governor and affordability is what everyone needs,"Virginia's 75th governor outlines her power to tackle the state's affordability crisis, focusing on housing, healthcare and energy costs affecting residents.",2025-12-26 10:00:10+00:00,Fox News,https://www.foxnews.com/opinion/im-new-virginia-governor-affordability-what-everyone-needs,-0.4588,0.058,0.113,0.829,negative,2025-12-26
solar energy,Meteorologist Dr. Ryan Maue Warns “Germany Won’t Make It” If Winter Turns Severe,"Meteorologist Dr. Ryan Maue warns at X that if the winter of 1962-1963 happened again with today’s Europeean energy system, then “Germany won’t make it”. The country has “exceptional energy shortfalls.”",2025-12-26 10:00:00+00:00,Wattsupwiththat.com,https://wattsupwiththat.com/2025/12/26/meteorologist-dr-ryan-maue-warns-germany-wont-make-it-if-winter-turns-severe/,-0.0516,0.088,0.113,0.798,negative,2025-12-26
solar energy,Green Debt Surge Bucks Climate Policy Rollbacks,"Global green bond and loan issuance has reached a record $947 billion so far this year, according to data compiled by Bloomberg Intelligence.",2025-12-26 08:44:24+00:00,Rigzone,https://www.rigzone.com/news/wire/green_debt_surge_bucks_climate_policy_rollbacks-26-dec-2025-182620-article/,0.25,0.136,0.076,0.788,positive,2025-12-26
solar energy,China Solar Buildout in Nov Is Highest in 6 Months,"About 22 GW were installed last month, according to the National Energy Administration.",2025-12-26 08:35:03+00:00,Rigzone,https://www.rigzone.com/news/wire/china_solar_buildout_in_nov_is_highest_in_6_months-26-dec-2025-182619-article/,0.2732,0.091,0.0,0.909,positive,2025-12-26
solar energy,GIPC commissions final phase of 600 MW solar project at Khavda in Gujarat,"In the final phase, 135 MW of solar capacity was added at the project site located within the 2,375 MW Renewable Energy Park at Khavda",2025-12-26 07:47:35+00:00,BusinessLine,https://www.thehindubusinessline.com/companies/gipc-commissions-final-phase-of-600-mw-solar-project-at-khavda-in-gujarat/article70439148.ece,0.2732,0.054,0.0,0.946,positive,2025-12-26
solar energy,E&E News: “The Paris Agreement at 10: What the World has Achieved”,"Not much, really. Just a whole lot of waste and false hopes with massive government intervention to create a wind/solar/battery bubble. The subtitle of the CLIMATEWire piece said much: “The blockbuster climate deal made history a decade ago. But its record at…",2025-12-26 06:00:00+00:00,Wattsupwiththat.com,https://wattsupwiththat.com/2025/12/25/ee-news-the-paris-agreement-at-10-what-the-world-has-achieved/,0.6249,0.143,0.034,0.823,positive,2025-12-26
solar energy,"Grid Down, Power Up: The silent threat to national survival","The U.S. power grid is critically vulnerable due to its aging infrastructure, centralized design for efficiency over resilience, and underinvestment in security, making it a prime target for adversaries. A prolonged, nationwide grid failure would be catastrop…",2025-12-26 06:00:00+00:00,Naturalnews.com,https://www.naturalnews.com/2025-12-26-grid-down-power-up-threat-national-survival.html,-0.6908,0.09,0.194,0.716,negative,2025-12-26
solar energy,AI’s thirst for power is testing grids worldwide,"Surging electricity demand from AI and cryptocurrency data centers is straining power grids worldwide. Thermal satellite imagery reveals the immense heat output and energy intensity of these facilities. Many new data centers are being built in hot climates, w…",2025-12-26 06:00:00+00:00,Naturalnews.com,https://www.naturalnews.com/2025-12-26-ais-thirst-for-power-testing-global-grids.html,-0.1779,0.042,0.076,0.882,negative,2025-12-26
solar energy,Vikran Engineering secures ₹459 crore solar EPC contract from NTPC,"The contract involves the Balance of System package for the grid-connected solar project, with a completion timeline of 12 months",2025-12-26 05:21:41+00:00,BusinessLine,https://www.thehindubusinessline.com/markets/stock-markets/vikran-engineering-secures-459-crore-solar-epc-contract-from-ntpc/article70438891.ece,0.3182,0.076,0.0,0.924,positive,2025-12-26
solar energy,"Narendra Solanki sees select opportunities in metals, GLP-1 and solar plays","Amid global uncertainty, market expert Narendra Solanki advises theme-based investing.  He highlights opportunities in specific metals like steel and copper, niche pharma plays focusing on GLP-1 drug delivery mechanisms, and renewable-linked manufacturing, pa…",2025-12-26 04:58:55+00:00,The Times of India,https://economictimes.indiatimes.com/markets/expert-view/narendra-solanki-sees-select-opportunities-in-metals-glp-1-and-solar-plays/articleshow/126183307.cms,0.8074,0.225,0.046,0.729,positive,2025-12-26
solar energy,Webb maps carbon rich atmosphere on distorted pulsar planet,"Berlin, Germany (SPX) Dec 17, 2025


Scientists using NASA's James Webb Space Telescope have identified an exoplanet with an atmosphere unlike any seen before, orbiting a rapidly spinning neutron star known as a pulsar. The object, officially designated PSR J…",2025-12-26 04:40:00+00:00,Space Daily,https://www.spacedaily.com/reports/Webb_maps_carbon_rich_atmosphere_on_distorted_pulsar_planet_999.html,0.2263,0.07,0.053,0.877,positive,2025-12-26
solar energy,Lunar dust model maps how charged grains stick to spacecraft,"Tokyo, Japan (SPX) Dec 26, 2025


Researchers from Beijing Institute of Technology, China Academy of Space Technology, and the Chinese Academy of Sciences have developed a theoretical model that links electrostatic forces and contact mechanics to describe how…",2025-12-26 04:40:00+00:00,Moondaily.com,https://www.moondaily.com/reports/Lunar_dust_model_maps_how_charged_grains_stick_to_spacecraft_999.html,-0.2023,0.0,0.038,0.962,negative,2025-12-26
solar energy,"Hindustan Zinc shares in focus as silver prices scale record highs, surge past $75 mark","Hindustan Zinc shares surged to a new peak, driven by soaring global silver prices that crossed $75 per ounce. The company, a top global silver producer, is benefiting from robust industrial demand and supply constraints, with silver contributing significantl…",2025-12-26 03:42:19+00:00,The Times of India,https://economictimes.indiatimes.com/markets/stocks/news/hindustan-zinc-shares-in-focus-as-silver-prices-scale-record-highs-surge-past-75-mark/articleshow/126182369.cms,0.7269,0.151,0.026,0.823,positive,2025-12-26
solar energy,Golden Galapagos by GET Expands Luxury Fleet With Addition of Next-Generation Catamarans M/C Monique and M/C Grand Ocean Spray,"Quito, Ecuador, Dec. 25, 2025 (GLOBE NEWSWIRE) -- Golden Galapagos by Golden Experiences & Travel (GET), a Certified B Corporation® and a leader in luxury sustainable travel in Galapagos Islands and the Ecuadorian Amazon, has announced the addition of two nex…",2025-12-26 03:27:00+00:00,GlobeNewswire,https://www.globenewswire.com/news-release/2025/12/26/3210495/0/en/Golden-Galapagos-by-GET-Expands-Luxury-Fleet-With-Addition-of-Next-Generation-Catamarans-M-C-Monique-and-M-C-Grand-Ocean-Spray.html,0.6249,0.103,0.0,0.897,positive,2025-12-26
solar energy,Column: Simplify process to bring balcony solar power to Hawaii | Honolulu Star-Advertiser,"Most people in Hawaii want to reduce their electricity costs and participate in the transition to clean, renewable energy. But for many who live in condos or apartments, going solar has not been an option. That could soon change — if lawmakers act.",2025-12-26 03:00:44+00:00,Honolulu Star-Advertiser,https://www.staradvertiser.com/2025/12/25/editorial/island-voices/column-simplify-process-to-bring-balcony-solar-power-to-hawaii/,0.3716,0.082,0.0,0.918,positive,2025-12-26
solar energy,"15 stocks including Ola, IndusInd Bank, Lenskart, Vodafone Idea, IndiGo, Gujarat Gas will remain in focus on Friday","Other buzzing stocks: Supreme Industries, JK Cement, AVG Logistics, Vikran Engineering, Deepak Fertilisers, Aequs, Manaksia, KNR Constructions",2025-12-26 02:08:34+00:00,BusinessLine,https://www.thehindubusinessline.com/markets/15-stocks-including-ola-indusind-bank-lenskart-vodafone-idea-indigo-gujarat-gas-will-remain-in-focus-on-friday/article70438738.ece,0.7378,0.159,0.0,0.841,positive,2025-12-26
solar energy,Green debt sales hit record levels in 2025 despite climate backlash,The flows are notable in year when Trump backed fossil fuels and dismantled clean-energy subsidies and legislation. Read more at straitstimes.com. Read more at straitstimes.com.,2025-12-26 01:30:49+00:00,The Straits Times,https://www.straitstimes.com/business/companies-markets/green-debt-sales-hit-record-levels-in-2025-despite-climate-backlash,-0.34,0.029,0.066,0.904,negative,2025-12-26
solar energy,"Stocks To Watch Today: Ola Electric, Swiggy, Eternal, L&T, Vikran Engineering And More","Shares of Cipla Ltd., Ambuja Cements Ltd., Prestige Estates Projects Ltd. and One 97 Communications Ltd. are going to catch investors' attention on Tuesday.",2025-12-26 01:30:00+00:00,Ndtvprofit.com,https://www.ndtvprofit.com/markets/stocks-to-watch-today-ola-electric-swiggy-eternal-lt-vikran-engineering-and-more,0.3597,0.065,0.0,0.935,positive,2025-12-26
solar energy,Global Times- 2025 Yearender: China as a visionary power in a turbulent world,"Amid global turmoil in 2025, China emerged as an oasis of certainty through stable governance, future planning, diplomacy, innovation and green growth. Amid global turmoil in 2025, China emerged as an oasis of certainty through stable governance, future plann…",2025-12-26 01:28:00+00:00,GlobeNewswire,https://www.globenewswire.com/news-release/2025/12/26/3210487/0/en/Global-Times-2025-Yearender-China-as-a-visionary-power-in-a-turbulent-world.html,0.875,0.27,0.079,0.651,positive,2025-12-26
solar energy,VIJAY JAYARAJ: Energy Transition Meltdown Could Mean Global Bifurcation,"History will likely remember 2025 as the year energy corporatists finally stopped pretending there is a climate crisis. For a decade, a bizarre theater",2025-12-26 01:21:47+00:00,The Daily Caller,https://dailycaller.com/2025/12/25/opinion-energy-transition-meltdown-could-mean-global-bifurcation-vijay-jayaraj/,-0.5719,0.148,0.219,0.633,negative,2025-12-26
solar energy,"Stock Market Highlights 26 December 2025: Markets slide for third straight session as foreign fund outflows drag Sensex 367 points, Nifty slips 99.80 points to 26,042.30","Sensex, Nifty Live Updates on 26 December 2025: Falling for the third consecutive day, Sensex dropped 367.25 points or 0.43 per cent to settle at 85,041.45 in a thin trade. During the day, it tanked 470.88 points or 0.55 per cent to 84,937.82.
 Nifty declined…",2025-12-26 01:00:12+00:00,BusinessLine,https://www.thehindubusinessline.com/markets/stock-market-highlights-december-26-2025/article70436649.ece,0.7579,0.129,0.045,0.826,positive,2025-12-26
solar energy,"Stocks in news: IndusInd Bank, Ola Electric, IndiGo, Castrol India, Sun Pharma, RIL","Indian markets saw a subdued trading session on Wednesday, ending marginally lower. This consolidation follows a recent surge. Analysts suggest a positive outlook, recommending buying on dips as the Nifty maintains its uptrend. Banking index participation is …",2025-12-26 00:41:00+00:00,The Times of India,https://economictimes.indiatimes.com/markets/stocks/news/stocks-in-news-indusind-bank-ola-electric-indigo-castrol-india-sun-pharma-ril/articleshow/126177085.cms,0.659,0.121,0.037,0.843,positive,2025-12-26
solar energy,Green power is cheaper than ever; so why are discoms chasing coal?,"Lower prices alone aren't enough for electricity distributors in states—They need stable power at all times, and they do not want to worry about battery supply issues in the future. The answer is right before them: Good old coal, costly and polluting, but rel…",2025-12-26 00:00:36+00:00,Livemint,https://www.livemint.com/industry/energy/indias-green-energy-demand-takes-another-hit-with-discoms-inking-costlier-coal-fuelled-ppas-11766666038668.html,0.2124,0.088,0.091,0.821,positive,2025-12-26
solar energy,Comparative analysis of solar still with and without use of coating of waste toner powder on absorber plate and hyperbolic fins,Scientific Reports - Comparative analysis of solar still with and without use of coating of waste toner powder on absorber plate and hyperbolic fins,2025-12-26 00:00:00+00:00,Nature.com,https://www.nature.com/articles/s41598-025-23021-y,-0.6808,0.0,0.118,0.882,negative,2025-12-26
solar energy,Oxygen-modulated engineering of Cu0–Cu+ interfaces for CO2-to-C2H4 photoreduction,"Ru0.6Cu1(Cu0–Cu1+)/CeO2 catalyst converts CO2-to-fuels via artificial photosynthesis, overcoming O2 poisoning and sluggish C2 yield through photothermal interface reconstruction. It achieves 74.3% selectivity for C2H4 with 0.5% solar efficiency.",2025-12-26 00:00:00+00:00,Nature.com,https://www.nature.com/articles/s41467-025-67844-9,-0.6124,0.06,0.155,0.786,negative,2025-12-26
solar energy,Oxygen spillover engineering design in atomically dispersed sites for high-efficiency photoproduction of hydrogen peroxide from water,"Energy Environ. Sci., 2026, Accepted ManuscriptDOI: 10.1039/D5EE06121K, PaperXueming Dang, Shuai Wu, Qian Li, Xiaorong Gan, Alex K. Y. Jen, Dangyuan Lei, Huimin ZhaoThe photocatalytic non-sacrificial hydrogen peroxide (H2O2) production is a sustainable and co…",2025-12-26 00:00:00+00:00,Royal Society of Chemistry,https://pubs.rsc.org/en/content/articlelanding/2026/ee/d5ee06121k,0.4939,0.082,0.0,0.918,positive,2025-12-26
solar energy,"Taiwan's energy transition at risk as solar grid connections see historic low, foreign divestment","Taiwan's energy transition is facing unprecedented challenges. In 2025, domestic solar power grid connection capacity plunged to an all-time low, squeezed by the dual pressures of policy instability and tightening regulations. Industry leaders warn that if th…",2025-12-25 23:41:07+00:00,Digitimes,https://www.digitimes.com/news/a20251223PD201.html,-0.5423,0.094,0.171,0.735,negative,2025-12-25
solar energy,Dog photographed alone in parked Tesla with message on touch screen stuns social media users: 'Every car should have this option',"""One of the reasons I want a Tesla!""",2025-12-25 23:30:00+00:00,Yahoo Entertainment,https://www.yahoo.com/lifestyle/articles/dog-photographed-alone-parked-tesla-233000225.html,-0.2244,0.094,0.07,0.836,negative,2025-12-25
solar energy,India's solar boom faces a hidden waste problem,A recent study has found that India will generate over 11 million tonnes of solar waste by 2047 if it does not scale up recycling.,2025-12-25 23:11:20+00:00,BBC News,https://www.bbc.com/news/articles/cd6x75x4j02o,-0.8074,0.0,0.229,0.771,negative,2025-12-25
solar energy,Can an old nuclear power plant have a green future?,It is 70 years since work started on the Chapelcross site which now hopes to become a green energy hub.,2025-12-25 21:54:33+00:00,BBC News,https://www.bbc.com/news/articles/cpq4xr0pj1jo?xtor=AL-72-%5Bpartner%5D-%5Byahoo.north.america%5D-%5Bheadline%5D-%5Bnews%5D-%5Bbizdev%5D-%5Bisapi%5D,0.5994,0.159,0.0,0.841,positive,2025-12-25
